id,project,status,target_completion_date,highway_transit_line,estimated_total_budget,latitude,longitude,category,supporting_ministry,community,description,result,area,region,address,postal_code,municipal_funding,provincial_funding,federal_funding,other_funding,website
905,NWA #33 Dogpaw Water Treatment Plant Upgrades Project,Planning,2024-01-01,,0,49.234799,-93.564301,Communities,Infrastructure,Northwest Angle #33 First Nation,"The Project will rehabilitate and upgrade the existing water treatment facility in the Northwest Angle #33 First Nation. The work involves constructing an addition next to the existing water plant with a new below ground reservoir,  fire pumps and 2 new treatment skids.  The existing SCADA system, chemical feed system, and genset will be repaired or replaced and there will be minor upgrades to the existing office, washroom, and chemical room. Electrical upgrades will be conducted as required. The existing intake system will be reviewed to determine if it is suitable for future use. The project will include the commissioning of the new equipment and decommissioning of the existing equipment.",,,Northwest,General Delivery-Box 1490,P9N3X7,Yes,Yes,Yes,,
914,Replace Existing Distribution Water Main at West End WTP and Upgrade 10 Residential Septic Fields,Planning,2024-01-01,,0,49.709837,-94.60089,Communities,Infrastructure,Obashkaandagaang First Nation,"The project will upgrade potable water distribution and rehabilitate ten failed septic fields in the Obashkaandagaang First Nation. The work involves replacing approximately 1,200 metres of water main with wider piping and installing approximately 800 metres of water service lines. Curb stop valves, fire hydrants and services lines will be removed, replaced, added or upgraded as required, restoring the functionality of ten septic fields. The existing distribution watermain and services lines will be removed and disposed of and temporary water services provided to all affected individuals during the project.",,,Northwest,Box 625,P0X1C0,Yes,Yes,Yes,,
917,Ojibway Nation of Saugeen Well Upgrades,Planning,2023-01-01,,0,50.5,-90.76,Communities,Infrastructure,Ojibway Nation of Saugeen First Nation,"The Project is for the improvement of safe, reliable potable water in the Ojibway Nation of Saugeen First Nation. The work will involve inspecting approximately 38 wells, installing point-of-entry or point-of-use systems for each residential well, upgrading existing point-of-entry systems for non-residential wells, commissioning a multiplex well, the installation/completion of a point-of-entry or point-of-use system for the multiplex well, and the repair of non-operational or damaged equipment.",,,Northwest,91 sapay street,P0V2S0,Yes,Yes,Yes,,
919,Rehabilitation of Hydrants,Planning,2023-01-01,,4680,49.11104,-93.92618,Communities,Infrastructure,Ojibways of Onigaming First Nation,Repair damaged hydrants in the community.,Improved reliability of the water system.,,Northwest,,,,Yes,Yes,Yes,
920,Ojibways of Onigaming Water Treatment Plant Upgrades,Planning,2023-01-01,,0,49.18254,-93.927217,Communities,Infrastructure,Ojibways of Onigaming First Nation,"The project will rehabilitate and modernize the water treatment plant in the Ojibways of the Onigaming First Nation. The work will include upgrading the ozone pre-treatment system, replacing filters, identifying and repairing leaks, splitting the pumping chamber for cleaning/maintenance and adding backwash capability to support better maintenance, upgrading the plant’s computer control system, rehabilitating the fixed diesel generator cooling system, acquiring replacement parts for the plant’s chlorine water treatment system and additional sampling.",,,Northwest,703 Ketemiikana Rd,P0X1K0,Yes,Yes,Yes,,
923,Pic River Water Treatment Plant Replacement,Planning,2024-01-01,,0,48.614086,-86.28602,Communities,Infrastructure,Ojibways of the Pic River First Nation,"The Project will decommission the existing water treatment plant (WTP) and construct a new WTP in Biigtigong Nishnaabeg First Nation. The work will involve constructing a WTP building, an infiltration gallery, a low lift station complete with wet well and low lift pump chamber, and a below-grade reservoir. In addition, a new conventional treatment system, PLC/SCADA system, high lift pumps, fire pumps, a new backup generator and a new septic system will be installed along with necessary pipes and mechanical and electrical work.",Deliver high-quality water and better fire protection for community residents.,,Northwest,78 Pic River Road,P0T1R0,Yes,Yes,Yes,,
984,"Renovation and Rehabilitation of Bronson Centre Community, Culture and Recreation Hub",Planning,2025-01-01,,0,45.413349,-75.706778,Communities,Infrastructure,Ottawa,"Financially sustainable response to demand from low income and culturally diverse communities for access to affordable, not for profit space and services in downtown Ottawa,Improve access to the centre through rehabilitation of main, rear, and side entrance-ways and related façade stoneworkImprove quality of experience, functionality, creative use, improved accessibility of our day use studios for clienteleReduced operating costs of our 45,000 sq ft facility based on our maintenance planImprove functionality, accessibility by replacing 30-40 year old entranceway doors with auto-openers, crash bars, and environmental efficienciesImprove quality of experience and cost efficiencies by replacing 75%+ (210 units) “critical-issue” windows with high efficiency, thermal paneAddress basic functionality, safety, and thermal issues with façade at main entranceways by rehabilitating stone work Upgrade ten studio spaces and theatre for creative arts use that also improves seniors accessBronson Centre community of tenants serves the following populations:Indigenous (2 organizations)Culturally diverse and immigrant (Afro-Caribbean, African, Latin, Chinese, South Asian, other)Seniors (low income, culturally diverse)Youth at risk (visible minority, low income families)Currently 20,000 persons/month up to 25,000 / month by 2021Serving Ottawa and region.",,Ottawa,East,211 Bronson Avenue,K1R6H5,Yes,Yes,Yes,Yes,https://www.news.ontario.ca/en/release/1000012/canada-and-ontario-invest-in-improved-community-and-culture-infrastructure-in-ottawa
1072,Pikangikum First Nation Transitional Housing Project,Planning,2021-01-01,,0,51.8042,-93.9927,Communities,Infrastructure,Pikangikum First Nation,"The project is entirely planned to benefit Indigenous people living on-reserve, specially vulnerable population.  Allow the members to remain in the community, rather than being displaced by the Justice System.Allow the families to have access to their family members who may be involved in the justice system.    Provides temporarily accommodation to address domestic violence issues due to severe over-crowding of houses which connects to physical and physiological well-being.The structure of the building is being researched, designed and constructed in partnership with Natural Resources Canada.  The facility will comprise of a sleeping module which will house approximately 16 people using double occupancy per room, the gathering module which will consist of a community kitchen, public bathrooms, office space and healing rooms, common gathering area and conference rooms.  The exterior structures will include a deck, ramp and canopy.Pikangikum First Nation plans to build a small cultural gathering place as part of the main structure (bail house or transitional housing).  The gathering space (sub-structure) will provide common space to provide services to accused individuals and their families.  The services will be provided by qualified and accredited mental health workers, family councilors, Elders, legal workers, traditional healers. Full details are outlined in the the business case.",,,Northwest,Box 300,P0V2L0,Yes,Yes,Yes,,https://www.news.ontario.ca/en/release/61149/canada-and-ontario-invest-in-improved-community-cultural-and-recreational-facilities-in-first-nation-3
1075,Replacement of Lids on the Digester Tanks,Under construction,2024-01-01,,262427,42.997048,-82.418162,Communities,Infrastructure,Point Edward,Replace the lids on the digester tanks.,Reduction of gases being released into the atmosphere.,Lambton,Southwest,92 Alexandra Avenue,N7V 1C2,Yes,Yes,Yes,Yes,
1125,Ma-te-Way Activity Centre Expansion,Planning,2023-01-01,,0,45.465439,-76.694309,Communities,Infrastructure,Renfrew,"Develop off reserve Indigenous Cultural CentreReplace outdated non accessible Recreation Centre to foster greater accessibility for allMeet community and user needs and service gaps with enhanced recreation facilities and increased spacePromote good value through partnerships and efficient build and operationsThis project will replace an outdated non accessible facility and expand a separate and existing recreation facility. The newly constructed, 76,500 ft2 fully accessible facility, will improve upon and enhance outdated infrastructure to include an Indigenous cultural centre, fitness centre, walking track, multipurpose rooms, ice surface, lease space and all amenities. The project will increase facility traffic by 75%, increase new members by 50% and increase awareness of recreation opportunities.This project will primarily serve a population with a 25km radius of Renfrew which equates to 27,800 residents in Ontario in addition to 1500 residents in Quebec. Populations served include 5000 members from Algonquin First Nation and 22.4% low income families (2015 stats).  Communities served include Renfrew, Admaston Bromley, Horton, Greater Madawaska, McNab Braeside, Whitewater, Bonnechere Valley, North Algona Wilberforce and Arnprior.",,Renfrew,East,127 Raglan Street/Rue South/Sud,K7V1P8,Yes,Yes,Yes,,https://www.news.ontario.ca/en/release/61197/canada-and-ontario-invest-in-improved-recreational-and-cultural-infrastructure-in-renfrew
1135,Robbins Family Centre,Planning,2023-01-01,,0,43.844913,-79.457123,Communities,Infrastructure,Richmond Hill,"To build a youth centre that increases accessibility to our programs by bringing them under one roof on a major road well-served by public transit, vs renting multiple spaces across VaughanTo provide a safe space where teens can gather, relax, play sports, study and talk about problems/questions with staff trained to recognize mental health issues, and be empowered through leadership training, community service and mentoring of young childrenTo increase number of youth served/yearConstruction began in May 2019. We are requesting funding for later-stage components (starting Fall 2020) for which contracts have not yet been awarded, including: Basketball Court/Gym, floor tiling, interior/exterior trim, hardware, interior/exterior painting, exterior caulking, railings, cabinetry/counter-tops for kitchens, deck/patio, Teen Lounge stone fireplace, and hard/soft landscaping.We currently serve over 1,000 youth aged 14-18 per year. In the first year after the building is finished, we expect this to increase to 2,000, and by Year 5, to 5,000. Most youth will come from the City of Vaughan  and the Town of Richmond Hill, but we currently have members from Aurora, Markham and North York as well. At least 40% of the youth will come from newcomer or low-income families, and all are welcome, regardless of religious affiliation.",,York,Central,8700 BATHURST ST,L4J9J8,Yes,Yes,Yes,Yes,https://www.news.ontario.ca/en/release/1000028/canada-and-ontario-invest-in-increased-access-to-cultural-and-community-facilities-for-youth-in-richmond-hill
1148,Sagamok Anishnawbek Water Infrastructure,Planning,2023-01-01,,0,46.15731,-82.11003,Communities,Infrastructure,Sagamok Anishnawbek First Nation,"The Project will upgrade the drinking water distribution and storage systems in the Sagamok Anishnawbek First Nation. The work will involve extending and looping the existing, closed watermain by approximately 1,230 metres and adding fire hydrants along the new section; upgrading the water tower by replacing the internal liner and rooftop coating, addressing safety issues; swabbing and flushing approximately 18 km of watermains; and upgrading the infrastructure at two pump houses by replacing three water pumps and piping and adding a fixed generator for each pump house.",,,Northeast,4007 Espaniel Street,P0P1P0,Yes,Yes,Yes,,
1149,Community Wide Stormwater Improvement,Under construction,2023-01-01,,32157,53.050354,-93.333305,Communities,Infrastructure,Sandy Lake First Nation,Remove the current storm-water culvert systems and install new culverts in the identical locations using existing/ original granular backfill materials.,Improved community stormwater drainage.,,Northwest,,,,Yes,Yes,Yes,
1151,Repairs and Upgrades at Sewage Lift Stations,Under construction,2023-01-01,,196500,53.050354,-93.333305,Communities,Infrastructure,Sandy Lake First Nation,Repair and upgrade five sewage lift stations.,Improved protection to receiving environment by protecting against overflows due to pump failure.,,Northwest,,,,Yes,Yes,Yes,
1152,Sarnia Sewer Upgrades,Under construction,2023-01-01,,30017232,42.955451,-82.403535,Communities,Infrastructure,Sarnia,"Upgrades throughout system, including replacement of Green Street Pump Station and Forcemain, new Bedford Pumping Station, improvements to Sarnia Water Pollution Control Centre and decommissioning of older pump stations","Reduced risk of effluent quality issues, sewer backups, and environmental contamination",Lambton,Southwest,East of Murphy Road,N7T 7N2,Yes,Yes,Yes,,
1166,Cultural Centre at Algoma University,Planning,2024-01-01,,0,46.500734,-84.286937,Communities,Infrastructure,Sault Ste. Marie,"Solidify Algoma University as a recognized leader in Truth and Reconciliation and cross-cultural teaching and learningImprove the level of access to culturally appropriate space for the local urban indigenous population and surrounding rural First NationsBridge the cultural knowledge gap between public and Indigenous communities by fostering an environment of cultural understanding and sensitivity towards Indigenous peopleAlgoma University is seeking to construct a new facility that will promote and celebrate Anishinaabe culture on campus, in the region of Sault Ste. Marie and throughout Northern Ontario. The facility will consist of an expansion and renovation to the East Wing of the University. The space will encapsulate the Indigenous history of Shingwauk Residential School, the increasing diversity on campus, and the promotion of the University’s Special Mission of cross-cultural teaching and learning.As the project is intended to advance reconciliation throughout the local region, the Cultural Centre will:Provide the local indigenous population with a culturally appropriate space for programs, events and gatherings Provide visitors with the opportunity to participate in intensive learning experiences and programs regarding Truth and Reconciliation and the Residential Schools Legacy",,Algoma,Northeast,1520 QUEEN ST E,P6A2G4,Yes,Yes,Yes,Yes,https://www.news.ontario.ca/en/release/1000166/canada-and-ontario-invest-in-new-indigenous-cultural-centre-at-algoma-university
1176,Seine River Water Treatment Distribution System Rehabilitation,Planning,2024-01-01,,0,48.719872,-92.416485,Communities,Infrastructure,Seine River First Nations,"The Project will rehabilitate components of the water distribution system in the Seine River First Nation. The work includes complete repair of the distribution system and valving including locate valves, repairing/replacing 17 hydrants, flushing, swabbing and repairing approximately 2,000 metres of transmission pipes, and recoating and repairing/replacing an elevated storage reservoir (water tower).",,,Northwest,124,P0W1H0,Yes,Yes,Yes,,
1190,Ka-Na-Chi-Hih Treatment Centre Sioux Lookout Program Expansion,Planning,2023-01-01,,0,50.097832,-91.922035,Communities,Infrastructure,Sioux Lookout,"For health and safety enhancements to the project, we are requiring new modern, updated internal and external doors that will allow for enhanced security.  With the new doors we will be able to add fob systems that will promote an environment that is not encompass an institutionalized environment setting by eliminating key access.We would also be including interior wall repairs to allow for additional storage to better utilize space as we have limited infrastructure opportunities for increased space needed to effectively facilitate the programming.The following renovations at the building will occur:Internal and external door upgradesFob systems for doorsInterior wall repairsFixed storage for interior spaceAddition of countertopsElectrical upgradesDrainageLandscaping The key objectives of this project are:Expansion of the current Ka-Na-Chi-Hih treatment program model to Sioux Lookout to increase the number of youth served by the program.Renovate an existing structure to provide a safe, welcoming healing space that supports land-based and traditional practices.Provide a long-term residential treatment program in the area; this type of programming is currently not available locally to our Norther Ontario First Nation communities.",,Kenora,Northwest,Unit 102 100 ANEMKI PL,P7J1A5,Yes,Yes,Yes,Yes,
1192,Six Nations Master Drainage and Flood Remediation Plan,Under construction,2023-01-01,,500000,43.072281,-80.114504,Communities,Infrastructure,Six Nations of the Grand River Territory,Improvement to  drainage at six locations in the territory.,Flood damage mitigation,Brant,Southwest,Various,,,Yes,Yes,Yes,
1197,Six Nations of the Grand River Wastewater Lagoons Forcemain Upgrade Construction,Planning,2023-01-01,,0,43.06,-80.1,Communities,Infrastructure,Six Nations of the Grand River Territory,"The Project will replace a pressurized sewage pipe in the Six Nations of the Grand River. The work will involve the installation of a larger, approximately 932-metre forcemain through horizontal drilling that will connect the existing sewage lift station to the three-cell lagoon. The footprint of this forcemain replacement will not follow the alignment of the existing forcemain, it will take a shorter route involving one road crossing and one creek crossing.",,Brant,Southwest,1695 Chiefswood Road,N0A1M0,Yes,Yes,Yes,,
1198,Save the Evidence Phase 3: Exterior Restoration and Public Accessibility,Planning,2024-01-01,,0,43.127623,-80.240674,Communities,Infrastructure,Six Nations of the Grand River Territory,"Restore the Mohawk Institute BuildingImprove the Mohawk Institute Building’s public accessibility, including installation of barrier-free main entrance & elevatorEnhance public accessibility with a parking lot and accessible entrance to the Museum Building (not funded by Cultural Spaces)Opening this Site of Consciousness to the public to ensure the legacy of residential schools in Canada is shared with our national and global communities, told through the lens of the SurvivorsExterior restoration components include masonry and windowsInterior restoration including finishingsSecurity servicesAccessibility improvements include a barrier free entrance that will be the main entrance to the site, as well as an elevator. The site needs accessible components that are not part of the Cultural Spaces Fund. These include construction of a parking lot for easier public access to the site, and an accessible main entrance and lobby for the Museum Building (site's reception)The Mohawk Institute Building, and by extension the Woodland Cultural Centre, is an important national site for public education and healing. We welcome Indigenous and non-Indigenous audiences to come together and share in the knowledge of the legacy of residential schools, and the strength of Indigenous Cultures in Canada. We host groups from educational institutions (all levels) to provide enriched Indigenous-centred programming. Once open, we expect to see double our current annual visitors.","The work will allow the Woodland Cultural Centre to restore the Mohawk Institute Residential School site, allowing it to open as a national historical cultural site for public education and healing.",Brant,Southwest,184 MOHAWK ST,N3S2X2,Yes,Yes,Yes,Yes,https://www.news.ontario.ca/en/release/1000556/canada-and-ontario-invest-over-94-million-in-the-woodland-cultural-centre
1231,Glencoe Main Street Watermain Reconstruction,Planning,2022-01-01,,0,42.74973,-81.7055,Communities,Infrastructure,Southwest Middlesex,"The Project will replace the watermain along Main Street from Parkhouse Drive to Graham Street and Symes Street north to the town limits in Glencoe. The work will involve replacing approximately 1.5 kilometres of watermain with a new and larger pipe, as well as replacing existing water services to residential and commercial properties which includes approximately 1 kilometre of water service pipes, reattaching the side street interconnections, installing 12 new fire hydrants and main line water valves. The affected roadway, curbs, sidewalks and driveways will also be replaced.",,Middlesex,Southwest,153 McKellar Street/Rue,N0L1M0,Yes,Yes,Yes,,https://www.news.ontario.ca/en/release/1000459/canada-and-ontario-invest-over-29-million-in-19-green-infrastructure-projects
1271,Wastewater Treatment Plant – Optimizations to Reduce Overflows and Improve Environmental Impact,Planning,2024-01-01,,0,42.779094,-81.193055,Communities,Infrastructure,St. Thomas,"This project is for the optimization and performance upgrades of the Wastewater Treatment Plant to remove bottle necks and increase flows during wet weather events in the City of St. Thomas. This project will conduct optimization and performance reviews of the sewage treatment plant; upsize the plant’s 3 influent flow meters, pipes, and plug valve; adjust the inter-plant flow distribution between 3 treatment plants to optimize flow; expand the effluent pumping station; replace associated infrastructure including the utility water system; expand the duplicate UV channel; replace and upsize the primary and secondary outfall pipes as well as the structure and backflow valve; and increase the berm height around the treatment plant as it is currently below the seasonal elevation.",,Elgin,Southwest,545 Talbot Street,N5P3V7,Yes,Yes,Yes,,https://www.news.ontario.ca/en/release/1000459/canada-and-ontario-invest-over-29-million-in-19-green-infrastructure-projects
1318,Serpent River Landfill Site,Under construction,2023-01-01,,584250,46.217499,-82.517139,Communities,Infrastructure,The North Shore,Expansion of the Serpent River landfill site.,Diverting recyclable waste,Algoma,Northeast,5931 Hwy 17,P0P 1V0,Yes,Yes,Yes,,
1366,MacDonald Block Reconstruction,Under construction,,,1536000000,43.663431,-79.387675,Communities,Infrastructure,Toronto,"Complete reconstruction of the 4 tower, 1,800,000 sq.ft.- office building over 8 years","An efficient, accessible and environmentally responsible workplace. Replaced building systems will reduce operating costs and improve energy performance.",Toronto,Central,900 Bay St.,M7A 2E1,,Yes,,,http://www.infrastructureontario.ca/Macdonald-Block-Reconstruction-Project/
1372,"Accessibility improvements to Meridian Arts Centre, North York",Planning,2023-01-01,,0,43.7663,-79.4141,Communities,Infrastructure,Toronto,"TO Live represents Meridian Hall (previously Sony Centre for the Performing Arts), St. Lawrence Centre for the Arts and Meridian Arts Centre (previously Toronto Centre for the Arts). As one of the largest multi-arts institutions in Toronto, we welcome people of all backgrounds, cultures and abilities to our spaces. After conducting an Accessibility Audit in 2018, we are increasing the physical accessibility of our spaces to better meet our community needs.As part of our commitment to accessibility, we will create accessible seating in all four Meridian Arts Centre theatres, including accessibility work areas for stagehands. This will require significant adjustments to seating in each theatre, as well as the construction of new elevators to serve the Greenwin Theatre and Studio Theatre.Increase accessible seating at Meridian Arts Centre (MAC) in the George Weston Recital Hall and will expand to include companion seating in the Lyric, Greenwin and Studio Theatres, bringing our seating to a minimum of 3% designated wheelchair spaces and 5% adaptive seating where practical within the confines of existing structure. With 380 staff and over 140,000 visitors to Meridian Arts Centre each year, we have significant communities who will benefit from accessibility improvements.",,Toronto,Central,City Hall 100 Queen Street/Rue West/Ouest,M5H2N2,Yes,Yes,Yes,,https://www.news.ontario.ca/en/release/1000497/canada-and-ontario-invest-over-38-million-to-support-two-recreation-and-cultural-facilities-in-north-york
