id,project,status,target_completion_date,highway_transit_line,estimated_total_budget,latitude,longitude,category,supporting_ministry,community,description,result,area,region,address,postal_code,municipal_funding,provincial_funding,federal_funding,other_funding,website
458,Expansion and Renovation of the Peach King Community Centre,Planning,2025-01-01,,0,,,Communities,Infrastructure,Grimsby,"To increase indoor leisure space in Grimsby, which will allow for improved and increased access to recreation and culture services that is operationally efficient.To respond to infrastructure priorities and service gaps, identified in the Master Plan, which will greatly increase citizen wellness and physical activity opportunities.To improve accessibility and support vulnerable populations, which will ensure that all members of the community can participate at their community centre.The Peach King Centre Expansion Project will increase the Town of Grimsby's indoor leisure infrastructure by adding a full-size gymnasium, indoor walking/wheeling track, multi-purpose program rooms, cultural space, EarlyON/preschool space, youth space and a unique and creative outdoor second floor recreation space.  The project includes improvements to accessibility, a renovated fitness centre and increased lobby/gathering spaces.  The outcome is a complete Community Centre for Grimsby.The project will serve the entire growing community of Grimsby (pop: 28,000+). Multi-use space will optimize a suite of programs and services for all citizens, and also priority groups including youth, seniors, inactive adults, vulnerable populations and new residents.  The project will improve physical and mental health in the community, and also promote local economic development.  This project will create partnership and space use opportunities with local sport, culture and leisure partners.",,Niagara,Central,160 Livingston Avenue,L3M0J5,Yes,Yes,,,https://www.news.ontario.ca/en/release/1000487/ontario-investing-over-16-million-to-expand-and-renovate-the-peach-king-centre-in-grimsby
489,Sewage pumping station rehabilitation.,Under construction,2025-09-01,,322500,43.268643,-79.957646,Communities,Infrastructure,Hamilton,"Rehabilitate, repair and/or replace various equipment at the Elgin St.  Rhodes Court  and Calvin St. sewage pumping station.",,Hamilton,Central,"Elgin Street, Dundas FC001, Rhodes Ct. Dundas DC009, 170 Calvin St. Ancaster HC011",,Yes,Yes,Yes,,
502,Hawkesbury Water Treatment Plant Clarifier Upgrades,Under construction,2023-01-01,,0,45.611527,-74.624784,Communities,Infrastructure,Hawkesbury,"The Project is for upgrades to the clarification process at the Water Treament Plant in the Town of Hawkesbury. The work involves de-commissioning a clarifier and repairing the walls, roof, floor slab, and surrounding framing to prevent further leakage and structural damage; replacing the clarifier with two new units; upgrading the building structure to accommodate the new clarifiers; and modifying a new control system.","Improve the quality of treated water, minimizing the risk of boil water advisories, and ensuring the long-term functioning of the plant.",Prescott and Russell,East,600 Higginson St,K6A1H1,Yes,Yes,Yes,,
512,Hiawatha First Nation - Rehabilitation and Upgrade of Communal Drinking Water Systems,Planning,2023-01-01,,0,44.173,-78.211,Communities,Infrastructure,Hiawatha First Nation,"The Project is for the rehabilitation of the water treatment system in the Hiawatha First Nation. The work will involve upgrading the water treatment plant by replacing two water distribution pumps, three chlorine pumps, a turbidity analyzer, and a coagulation system. A pressure tank will be replaced along with media, iron and cartridge filters, and ion exchange and ultraviolet disinfection systems at five communal drinking water systems. Over two kilometres of water distribution pipes will be installed to service six community buildings, three low-yield wells will be replaced with high yield wells, and 20 unused wells will be decommissioned. Security will be upgraded at the point of entry for the five communal drinking water systems and enclosures installed around water treatment equipment in two locations.",,,East,431 Hiawatha Line,K9J0E6,Yes,Yes,Yes,,
542,Water Distribution Renewal and Fire Protection Upgrades,Planning,2023-01-01,,0,49.615417,-95.109508,Communities,Infrastructure,Iskatewizaagegan #39 First Nation,"The project will replace a section of watermain and upgrade other components of the water distribution system in the Iskatewizaagegan #39 Independent First Nation (also known as Shoal Lake #39).The work will involve: replacing approximately 807 metres of concrete-lined, cast iron watermain with a wider, plastic pipe; installing 20 new gate valves; replacing two (2) fire hydrants, installing six (6) new hydrants; and replacing 45 water lines and curb stops from the watermain to residential properties.",,,Northwest,Box 1,P0X1E0,Yes,Yes,Yes,,
570,Gull Bay Lagoon Expansion,Planning,2022-01-01,,0,48.82139,-89.118333,Communities,Infrastructure,Kiashke Zaaging Anishinaabek First Nation,"This Project will expand the sewage lagoon in Gull Bay. The work will involve constructing an additional lagoon storage cell that will include an access road, a liner, high-level overflow, new intercell connection, control structure, discharge location, and outlet pipes.",,Thunder Bay,Northwest,General Delivery,P0T1P0,Yes,Yes,Yes,,
575,Killarney Landfill Leachate Collection and Treatment System,Under construction,2023-01-01,,553024,45.991045,-81.493349,Communities,Infrastructure,Killarney,Installation of a leachate collection and treatment system at the Killarney landfill site.,Diverting recyclable waste,Sudbury,Northeast,1111 Highway 637,P0M 2A0,Yes,Yes,Yes,,
587,Youth Campus Cultural Community Centre,Planning,2023-01-01,,0,44.236366,-76.500819,Communities,Infrastructure,Kingston,"Provide a safe, supportive and healing community centre for vulnerable youth 16-24 yrs old (including indigenous youth)Align this project with our ONE ROOF wrap around services from 27 different social agencies including (housing and mental health supports) within the attached building.Maximise the use of our existing facilities such as the full sized gym adjacent to the community centre space.Provide opportunities for cultural healing, skill development, socialization and self expression.Renovation to convert a church sanctuary to a community centre and supporting infrastructure: removal of pews; stage construction; Audio visual, lighting, and sound system installations; flooring and HVAC requirements.Demolition of a portion of the complex to add approx. 2500 sq. ft. of new construction to meet building code and accessibility issues for supporting washrooms, a kitchen able to support community centre functions and a multi-use meeting area.Serve as a community centre for homeless or vulnerable youth ages 16-24 including indigenous and LGBTQ+ youth.  30% of homeless youth who utilize our ONE ROOF program are indigenous. 500 youth per month will utilize the facility once programing is fully implemented. One focus for program delivery will be the utilization of the renovated sanctuary as a Indigenous Healing Centre.Other youth service agencies and non-profits will be able to use the facility as well.",,Frontenac,East,540 Montreal St.,K7K3J2,Yes,Yes,Yes,Yes,https://www.news.ontario.ca/en/release/1000657/canada-and-ontario-invest-over-2-million-in-improved-community-culture-and-recreational-infrastructure-in-eastern-ontario
607,Lac La Croix Water Treatment Plant Upgrades,Planning,2024-01-01,,0,48.372041,-92.158624,Communities,Infrastructure,Lac la Croix First Nation,"The Project will upgrade the water treatment plant in the Lac La Croix First Nation.The project involves building an addition for and installing ozonation and ultraviolet disinfection systems, repairing the chlorination disinfection and heating systems, repairing or replacing flow meters, distribution pump pressure relief valve, air release valve in wet well, online analyzers and other necessary equipment. In addition, a fire pump will be recommissioned, the intake and the low lake pumping and distribution system inspected, reservoirs will be cleaned and checked for leaks and automatic control of distribution pumps restored. Chlorine dosing system to be repaired and moved; installation of secondary containment for process chemicals, turbidimeters after each filter and locks on wet well hatches; and an inventory will be conducted of gate valves and curb stops.",,,Northwest,Neguaguon Lake I.R. P.O. Box 640,P9A3M9,Yes,Yes,Yes,,
625,Larder Lake Road Reconstruction Project - Phase 2 Wastewater and Water,Under construction,2023-01-01,,0,48.098711,-79.713739,Communities,Infrastructure,Larder Lake,"The project is phase 2 of a multi-phase reconstruction of Larder Lake Road in the Township of Larder Lake. This phase will replace all damaged watermains and damaged sections of sanitary sewer along approximately 1.7 kilometers of Larder Lake Road; the replacement and reconnection of water and wastewater pipes; and complete a repair, rehabilitation and/or installation of sewage maintenance access holes and fire hydrants; and the backfilling, surface preparation, paving and landscaping along the project route.",,Timiskaming,Northeast,69 Fourth Avenue,P0K1L0,Yes,Yes,Yes,,https://www.news.ontario.ca/en/release/1000459/canada-and-ontario-invest-over-29-million-in-19-green-infrastructure-projects
631,Upgrades to Water Pollution Control Plant Disinfection System,Planning,2023-01-01,,0,47.322407,-79.812,Communities,Infrastructure,Latchford,The Project is for the rehabilitation and upgrade of a water pollution control plant in Latchford. The work includes: rehabilitating and upgrading the plant’s chlorine contact chamber to allow for the installation of an ultraviolet water disinfection system and related piping and plant modifications; the construction of a new building; electrical and SCADA programming; instrumentation of the new processes; HVAC and odor control for the new building.,"Improved wastewater treatment by employing environmentally friendly methods to support year-round, continuous disinfection.",Timiskaming,Northeast,Town Of Latchford,P0J1N0,Yes,Yes,Yes,,
632,Laurentian Hills Wastewater System Treatment Upgrades,Planning,2025-09-01,,0,46.018,-77.45,Communities,Infrastructure,Laurentian Hills,"The Project is for the upgrade of a wastewater treatment facility in Laurentian Hills. The work includes an infiltration and inflow study, pipe repairs and disconnections of sump pumps. Aging plant components that will be replaced include the heating system, a grinder, influent pumps, a blower for aeration, clarifiers, aeration equipment, and a relined grit channel that captures heavy solids. In addition, new components will be added such as: a SCADA control system; a chlorine contact chamber, flocculants and coagulants for the treatment of wastewater effluent; and additional sludge holding capacity.",,Renfrew,East,34465 Highway No. 17 Highway,K0J1P0,Yes,Yes,Yes,,https://www.news.ontario.ca/en/release/1000459/canada-and-ontario-invest-over-29-million-in-19-green-infrastructure-projects
642,"Audrey, Margaret, Jane, Clair and Sherk Sewer Separation Program",Planning,2024-01-01,,0,42.03691,-82.60664,Communities,Infrastructure,Leamington,"The project will rehabilitate aging stormwater and sewer systems along Audrey, Margaret, Jane, Clair and Sherk streets in Leamington. The work will involve replacing approximately 1.2 kilometres of combined sewers with separate storm and sanitary sewers complete with new service connections from the main to property lines. Existing roadway, curbing, catchbasins, and signage will be replaced.  Sidewalk and lighting costs are planned to be enhanced by the Municipality of Leamington and are not eligible for reimbursement.",,Essex,Southwest,111 Erie Street/Rue North/Nord,N8H2Z9,Yes,Yes,Yes,,https://www.news.ontario.ca/en/release/1000459/canada-and-ontario-invest-over-29-million-in-19-green-infrastructure-projects
708,Upgrading/Relocation of Wastewater Lagoon,Planning,2023-01-01,,0,48.057298,-80.626111,Communities,Infrastructure,Matachewan First Nation,"The Project will relocate and replace the wastewater lagoon in the Matachewan First Nation.  The work will involve an investigation of and decommissioning the current structure and building a replacement lagoon on a new site, which will include an upgraded liner, road access and installation of a new overflow mechanism, outlet pipe and pump.",,,Northeast,1 Baden Rd.,P0K1M0,Yes,Yes,Yes,,
720,Lemieux Street Sanitary Sewer Rehabilitation,Planning,2023-01-01,,0,49.610094,-83.257544,Communities,Infrastructure,Mattice-Val Côté,"This project is for the replacement of a damaged sanitary sewer in the Ontario Northland railway bed and crossing above Five Mile Creek on Lemieux Street  in Mattice-Val Côté.The work includes replacing the existing sanitary sewer with a wider pipe, connecting it to an existing manhole and installing heat cables and pipe insulation; and flattening the slopes of the railway bed to stabilize the sanitary sewer with vibration and settlement monitoring installed.",,Cochrane,Northeast,"500, Highway 11 East",P0L1T0,Yes,Yes,Yes,,https://www.news.ontario.ca/en/release/1000459/canada-and-ontario-invest-over-29-million-in-19-green-infrastructure-projects
726,Virginiatown Collection and Distribution Upgrades,Planning,2024-01-01,,0,48.133797,-79.583755,Communities,Infrastructure,McGarry,"The Project will improve the drinking water distribution and wastewater collection systems in Virginiatown.The work will involve replacing approximately 650 metres of water main, approximately 650 metres of sewer pipe, fire hydrants, valves, manholes and associated equipment. In addition, storm water connections along Connell Avenue will be investigated and upgraded or repaired, as required, and approximately three (3) kilometres of sewer pipe will be assessed.",,Timiskaming,Northeast,27 Webster Street/Rue,P0K1X0,Yes,Yes,Yes,,https://www.news.ontario.ca/en/release/1000459/canada-and-ontario-invest-over-29-million-in-19-green-infrastructure-projects
740,Rehabilitation of Minden Hills Community Facilities for Accessibility,Planning,2024-01-01,,0,44.92724,-78.72748,Communities,Infrastructure,Minden Hills,"Meet community and user needs - Supporting access to public facilities to persons of all abilitiesPromote good asset management planning - retrofit of existing facilities to extend life and improve health and safety  Represents good value for money - serving upwards of 20% of population, procurement by tendering.Fosters greater accessibility - bring up to current OBC standards and meet AODA 2025 requirementsThe scope of the project is to rehabilitate/renovate/replace the entrance accessible ramps and doorways to two Community Centres ,one recreation facility and 1 cultural centre to meet current Ontario Building Code standards and to become compliant with the AODA 2025 requirements for municipalities.Minden Library/Cultural Centre – Located in one building, with multiple entrances. The existing retaining wall, stairs, ramps, and platforms around the Library and Cultural building are showing the effects of the shifting soils beneath them. Guardrails and handrails on top of the retaining walls and along stairs and ramps are rusting heavily and are in need of replacement.  The sidewalk to Cultural building has subsided enough that there is no wheelchair access to be had.  Lochlin Community Centre - Accessibility Upgrades - Ramp replacement, auto door operator.Irondale Community Centre  - Accessibility Upgrades - Ramp replacement, auto dooroperator.Minden Curling Club Building - Elevator / Lift: propose an elevator and air lock addition at the front of the building, taking advantage of the existing canopy.","These improvements will provide the associated communities with safer and more accessible entrances to community spaces, meeting current Ontario Building Code standards, while extending the life of these facilities.",Haliburton,East,7 Milne Street/Rue,K0M2K0,Yes,Yes,Yes,,https://www.news.ontario.ca/en/release/1000034/canada-and-ontario-invest-over-44-m-in-improved-culture-recreation-and-green-infrastructure-in-partnership-with-15-communities-across-ontario
744,New Osnaburgh Water Treatment Plant Upgrades,Planning,2025-01-01,,0,51.065,-90.273,Communities,Infrastructure,Mishkeegogamang First Nation,"The Project will expand and rehabilitate the water treatment plant in the Mishkeegogamang First Nation. The work will involve: constructing a new, below-grade storage reservoir; expanding and upgrading the water treatment plant building including better ventilation and spill containment areas; installing a new water treatment unit; rehabilitating disinfection treatment processes (UV and chlorination); installing a new, fixed back-up generator; adding three fire hydrants to the distribution network; adding settling tanks; installing a monitoring system (PLC/SCADA) and decommissioning unused equipment.",,,Northwest,1359 Anderson Rd,P9N4J8,Yes,Yes,Yes,,
756,Reconstruction of South Common Community Centre and Library,Planning,2027-03-01,,0,,,Communities,Infrastructure,Mississauga,"Reconstruct the South Common Community Centre and Library to improve access and quality of community infrastructure;Improve the indoor aquatic centre, including renewal of the pool deck and basin,  mechanical components and change rooms;Modernize and expand the fitness centre to provide a level of service consistent with other City operated club-format fitness centres;Integrate an indoor walking track; andIncrease the undersized gymnasium to a full size gymnasium dimensionProject scope includes demolition of existing structure, detailed design, and reconfiguration of the site for a building replacement that can include: Expanded club-format, equipment-based fitness centre;Indoor aquatics centre with therapeutic tank, and ancillary spaces; Indoor walking track;Full size gymnasium;Full size library (16,000 sf);Site development to include for outdoor activities; and Sufficient and accessible parking requirements, including pedestrian walkwaysThis project will position the South Common Community Centre and Library to meet the needs of the community over the 25 year outlook. With a high visible minority penetration rate of 63%, and a median after-tax household income level of $51,229, design and programing will ensure this populations needs are met. Additionally, accessibility will be enhanced with a one level design, and increases in program hours (46%), courses (42%), facility rentals (25%) and foot traffic (11%) are anticipated.",,Peel,Central,300 City Centre Drive,L5B3C1,Yes,Yes,,,https://www.news.ontario.ca/en/release/1000441/ontario-investing-over-45-million-to-reconstruct-the-south-common-community-centre-and-library-in-mississauga
780,Bayshore Road Wastewater Pumping Station Upgrade,Under construction,2023-01-01,,0,44.182865,-77.072507,Communities,Infrastructure,Mohawks of the Bay of Quinte First Nation,"The Project is for the upgrade of the Bayshore Road Wastewater Pumping Station located in the Mohawks of the Bay of Quinte First Nation. The work includes the installation of equalization tanks and variable frequency drives on existing pumps, and the replacement of two wastewater pumps, approximately 39 metres of pipes, valves, bases, rails, the motor control panel, generator and an automatic transfer switch. Mechanical and electrical systems will also be upgraded.",Provide efficient and reliable wastewater pumping to accommodate peak sewage flows.,,East,24 Meadow Drive,K0K1X0,Yes,Yes,Yes,,
792,"Second Street and Bay Road Sanitary Sewer, Watermain, and Storm Drainage Reconstruction",Planning,2023-01-01,,0,51.272426,-80.639192,Communities,Infrastructure,Moosonee,"This project is for the reconstruction of the sanitary sewer, watermain and storm drainage on Second Street (from Revillion Road to Bay Road) and Bay Road (from First Street to approximately 40m past the intersection of Second Street) in the Town of Moosonee. The work includes the replacement of approximately 795 meters of sanitary sewer and 7 manholes; approximately 17 sanitary services; the replacement of approximately 560 meters of watermain along with hydrants and valves; and the improvement of storm drainage with approximately 1,100 meters of roadside ditching, culvert installation, and stormwater inlet adjustments.",,Cochrane,Northeast,5 First Street/Rue,P0L1Y0,Yes,Yes,Yes,,https://www.news.ontario.ca/en/release/1000459/canada-and-ontario-invest-over-29-million-in-19-green-infrastructure-projects
810,Wastewater Plant Replacement,Planning,2024-01-01,,0,49.40944,-93.9536,Communities,Infrastructure,Naotkamegwanning First Nation,"The Project will replace and decommission an aging wastewater treatment facility with a new mechanical treatment plant in the Naotkamegwanning First Nation. The scope will involve the design and construction of a new wastewater facility that encompasses primary, secondary, and tertiary treatment with key components including headworks, primary clarifiers, a rotating biological contractor or moving bed biofilm reactor, ultraviolet disinfection, aerated sludge digestion or biological sludge conditioning, sludge dewatering, a new effluent outfall and diffuser, and ventilation upgrades. A back-up generator will be added or relocated to support the plant and existing lift stations.",,,Northwest,1800 Pawitik St,P0X1L0,Yes,Yes,Yes,,
856,Rehabilitation of Nibinamik Lagoon Sewage Treatment Lagoon and Collection Systems,Planning,2023-01-01,,0,52.791496,-88.456498,Communities,Infrastructure,Nibinamik First Nation,"The project will repair and replace components of a sewage lagoon and purchase a septictruck in Nibinamik First Nation. The work will include re-excavating and repairing 30manholes and covers, flushing outflow lines, removing and replacing two pressure reliefvalves, repairing damaged sections of the lagoon and buying a septic truck. The repairs tothe lagoon will include removal, replacement and repair of geomembrane areas, placingearth material above the liner for counter pressure and increasing the embankment height,and embankment repair work including excavation, removal and replacement of disturbedmaterial.",,,Northwest,General Delivery,P0T3B0,Yes,Yes,Yes,Yes,
859,Peat Moss System Rehabilitation,Under construction,2023-01-01,,63001,48.747069,-92.938378,Communities,Infrastructure,Nigigoonsiminikaaning First Nation,Repair the peat moss septic treatment systems for 3-4 houses.,Improved wastewater treatment and reduced contamination to receiving water bodies.,Rainy River,Northwest,,,,Yes,Yes,Yes,
861,Communal Wastewater Collection and Treatment Rehabilitation,Planning,2026-08-01,,0,49.9048,-94.543192,Communities,Infrastructure,Niisaachewan Anishinaabe Nation,"The project will rehabilitate the wastewater collection and treatment system in the Niisaachewan Anishinaabe Nation. The work will rehabilitate two lagoon cells by diverting the influent to the lagoons then cleaning, inspecting and repairing the lagoons as necessary including removal of fauna, sludge and other debris, replacing the lagoon liners, repairing the lagoon berms, and replacing valves and piping between the cells. Two wastewater sewage pumping stations will be cleaned, inspected for required repairs and upgraded including the replacement of four sewage pumps, wastewater pump vaults, flow meter, control systems and electrical panels. In addition, approximately 500 metres of road leading to the wastewater lagoon will be reconstructed.",,,Northwest,22 Band Office Road,P9N0J2,Yes,Yes,Yes,,
868,VLA Water Plant Replacement,Planning,2026-11-01,,0,46.364883,-79.881893,Communities,Infrastructure,Nipissing First Nation,"The Project is for the the construction of a replacement water treatment plant in the Nipissing First Nation. The work includes the drilling, pump testing, sampling and analysis of a new back-up well, the pump testing, sampling and analysis of the existing supply well, new pumps for each well, and pressure tanks to maintain system pressures. The treatment plant will include a separate chlorination room with secondary containment and independent ventilation, and a new treatment process with cartridge filtration, softening, ion exchange systems, UV disinfection and chlorination, analyzers for turbidity, chlorine and UV, and will ensure appropriate facilities for chlorination, containment, ventilation, connection to the water system, a chlorine contact pipe, and completion of the associated parking area.",,,Northeast,36 SEMO RD,P2B3K2,Yes,Yes,Yes,,
883,Wingham Standpipe Replacement,Planning,2024-01-01,,0,43.883634,-81.306086,Communities,Infrastructure,North Huron,"The Project is for the decommissioning of the current standpipe and constructing a new standpipe in Wingham. The work will include increased capacity, updated electrical, mechanical systems and buried infrastructure related to the standpipe, and a booster pumping station to be constructed at the same location to improve pumping capabilities, pressure, and provide redundancies. Emergency backup power will also be enhanced to provide increased safety measures.",,Huron,Southwest,274 Josephine Street/Rue,N0G2W0,Yes,Yes,Yes,,https://www.news.ontario.ca/en/release/1000459/canada-and-ontario-invest-over-29-million-in-19-green-infrastructure-projects
