id,project,status,target_completion_date,highway_transit_line,estimated_total_budget,latitude,longitude,category,supporting_ministry,community,description,result,area,region,address,postal_code,municipal_funding,provincial_funding,federal_funding,other_funding,website
2,Fort Frances Courthouse - Security  Improvements,Planning,2024-01-01,,0,,,Communities,Attorney General,Fort Frances,Creating single point of entry for all courthouse users and upgrading security equipment,Improved security as all courthouse users will have to be screened before entry into courthouse.,Rainy River,Northwest,333 Church Street,P9A 1C9,,Yes,,,
3,Gore Bay Courthouse - New Courtroom,Planning,,,0,,,Communities,Attorney General,Gore Bay,Creating new courtroom that is accessible.,Improved access to justice.,Manitoulin,Northeast,27 Phipps Street,P0P 1H0,,Yes,,,
5,Peterborough Courthouse - New Courtroom,Planning,,,0,,,Communities,Attorney General,Peterborough,Construction of new space at 470 Water Street and  renovation of space at 70 Simcoe Street which includes a new courtroom.,"Improved accessibility, security and access to justice with an additional courtroom.",Peterborough,East,70 Simcoe St,K9H 7G9,,Yes,,,
6,Sudbury Courthouse - Security Improvements,Planning,2025-10-01,,0,,,Communities,Attorney General,Sudbury,Creating single point of entry for all courthouse users and upgrading security equipment,Improved security as all courthouse users will have to be screened before entry into courthouse.,Sudbury,Northeast,155 Elm Street,P3C 1T6,,Yes,,,
13,Children's Treatment Centre of Chatham-Kent Redevelopment Project,Under construction,2026-09-01,,0,42.39653112,-82.22730515,Communities,"Children, Community and Social Services",Chatham-Kent,"New construction of an approx. 58,000 sq.ft. Children's Treatment Centre (CTC) in Chatham.",The new facility will improve service capacity and provision for children and youth with special needs in the Chatham-Kent area.,Chatham-Kent,Southwest,901 McNaughton Avenue West(McNaughton Ave W & Bear Line Rd),N7L 5P7,,Yes,,Yes,https://www.news.ontario.ca/en/release/1001527/ontario-building-new-childrens-treatment-centre-in-chatham-kent
22,Partner Facility Renewal - Waasegiizhig Nanaandawe'iyewigamig,Under construction,2025-09-01,,480300,49.765004,-94.487563,Communities,"Children, Community and Social Services",Kenora,Structural,Minor capital projects for repair/renovation/upgrades of existing buildings that will provide more secure and accessible facilities for people who use their services.,Kenora,Northwest,212 4th Ave South,P9N 1Y9,,Yes,,,
34,CHEO Integrated Treatment Centre,Under construction,2027-11-01,,371370000,45.400974,-75.651314,Communities,"Children, Community and Social Services",Ottawa,"Construct a new state-of-the-art children’s treatment centre on the CHEO campus, to offer critical services for children and youth with special needs.","Consolidation of services and improved support for developmental, rehabilitation, behavioural and mental health..",Ottawa,East,401 Smyth Rd,K1H 8L1,,Yes,,Yes,https://www.news.ontario.ca/en/release/52689/ontario-supports-the-childrens-hospital-of-eastern-ontario
35,Ronald McDonald House Charities (RMHC) - Ottawa site,Under construction,2025-10-01,,0,43.879,-79.03,Communities,"Children, Community and Social Services",Ottawa,"New expansion of approximately 25,000 sq. ft. to add 22 new suites into the existing RMHC building in Ottawa to accommodate up to 36 families who are away from home, while their child is receiving care at the Children’s Hospital of Eastern Ontario (CHEO).","The project will add 22 more suites to create a 36-suite facility that can accommodate families travelling 80 km and further with a sick child at Children Hospital of Eastern Ontario (CHEO). The project will expand the building envelope, and install life systems and outdoor enhancements.",Ottawa,East,,,,Yes,Yes,Yes,
41,Partner Facility Renewal - Community Living Dryden - Sioux Lookout,Under construction,2025-09-01,,599000,50.098878,-91.914688,Communities,"Children, Community and Social Services",Sioux Lookout,"Heating, Ventilating & AC",Minor capital projects for repair/renovation/upgrades of existing buildings that will provide more secure and accessible facilities for people who use their services.,Kenora,Northwest,41 King Street,P8T 1B8,,Yes,,,
50,Partner Facility Renewal - Geneva Centre for Autism,Under construction,2025-09-01,,390000,43.697081,-79.392812,Communities,"Children, Community and Social Services",Toronto,Roof Assembly & Waterproofing,Minor capital projects for repair/renovation/upgrades of existing buildings that will provide more secure and accessible facilities for people who use their services.,Toronto,Central,112 Merton Street,M4S 2Z8,,Yes,,,
51,Partner Facility Renewal - Bob  Rumball,Under construction,2025-09-01,,254000,43.734753,-79.380527,Communities,"Children, Community and Social Services",Toronto,Roof Construction,Minor capital projects for repair/renovation/upgrades of existing buildings that will provide more secure and accessible facilities for people who use their services.,Toronto,Central,2395 Bayview Avenue,M2L 1A2,,Yes,,,
53,MECP/MLITSD Science Complex,Planning,2030-09-01,,0,,,Communities,"Environment, Conservation and Parks",Oakville,Construction of a new Science Complex to replace the existing facilities at 81A and 125 Resources Road.,New Science Complex,Halton,Central,Hospital Gate and William Halton Parkway,,,Yes,,,
70,Alderville First Nation - Communal and POE Water Treatment Systems,Planning,2025-01-01,,0,44.1729,-78.0852,Communities,Infrastructure,Alderville First Nation,"This Project is for the rehabilitation and expansion of the water treatment system in the Alderville First Nation. The work includes drilling a new well; replacing small water treatment systems with a high-capacity, communal treatment plant with back-up power; installing an underground reservoir for water storage and high lift pump station; establishing a truck fill connection; installing approximately 750 metres of piping to connect the communal plant to 18 buildings; rehabilitating and upgrading 32 existing point-of-entry (POE) systems, adding 10 residential POE systems; and decommissioning unused wells.",,Peterborough,East,11696 2ND LINE RD,K0K2X0,Yes,Yes,Yes,,
77,Reconstruction of Sanitary Sewers on George and Seymour Streets,Planning,2023-01-01,,0,42.1016,-83.10746,Communities,Infrastructure,Amherstburg,"The Project will replace and reconstruct the sanitary sewer system on George and Seymour streets in the Town of Amherstburg. The work will involve installing approximately 900 metres of sanitary sewer and collection lines, and replacing manholes. The work will also involve asphalt restoration of the affected roadway.",,Essex,Southwest,271 Sandwich Street/Rue South/Sud,N9V2A5,,Yes,Yes,Yes,https://www.news.ontario.ca/en/release/1000459/canada-and-ontario-invest-over-29-million-in-19-green-infrastructure-projects
83,Anishinaabeg of Naongashiing Sewage Lagoon,Planning,2023-01-01,,0,49.118469,-94.313364,Communities,Infrastructure,Anishinaabeg of Naongashiing First Nation,"The Project will construct a new sewage lagoon with clay liner to replace the existing wastewater treatment plant in the Anishinaabeg of Naongashiing First Nation.The work will include clearing and preparing an undeveloped site for the lagoon, excavating trenches for collection pipes, building an access road, constructing the lagoon and its required components including flow meters/analyzer and outfalls, installing new gravity sewers and force mains, and upgrading  the existing lift station. The existing wastewater treatment plant will also be decommissioned and deconstructed.",,Rainy River,Northwest,General Delivery,P0W1J0,Yes,Yes,Yes,,
91,Replacement of the 400mm Madawaska River Water main,Planning,2024-01-01,,0,45.426952,-76.35253,Communities,Infrastructure,Arnprior,"The Project is for the replacement of a water main crossing the Madawaska River in Arnprior. The work will involve replacing the 400mm diameter water main, spanning from the water treatment plant to the elevated water storage tower, with the possibility of relocating the water main as well.",,Renfrew,East,105 Elgin Street/Rue West/Ouest,K7S0A8,Yes,Yes,Yes,,https://www.news.ontario.ca/en/release/1000459/canada-and-ontario-invest-over-29-million-in-19-green-infrastructure-projects
95,"Dungannon Drinking Water System Arsenic Treatment, Reservoir and Pump Station",Under construction,2023-01-01,,0,43.852382,-81.595209,Communities,Infrastructure,Ashfield-Colborne-Wawanosh,"The project will rehabilitate a water treatment facility in Dungannon.  The project will involve the construction of a new reservoir and a new pumphouse to accommodate the installation of new high-lift pumps to pump water from the new reservoir to the distribution system.  To connect the reservoir to the system, new piping will be installed downstream of the chlorine contact main.  The project will also include the relocation of the existing pressure tanks to the new pumphouse building, removal of the iron sequestering chemical feed system from the existing treatment building, and installation of new cartridge filter trains (in the existing treatment building) to remove arsenic. New variable frequency drives (VFDs), harmonic filters, as well as the associated electrical equipment and wiring will be installed. The existing MCC system will be improved by removing abandoned components (i.e. Well 1 starters) and reprogramming.  Depending on the additional electrical loads, a new power service feed and generator may also be required pending verification during the design phase.",,Huron,Southwest,82133 Council Line,N7A3Y2,Yes,Yes,Yes,,https://www.news.ontario.ca/en/release/1000459/canada-and-ontario-invest-over-29-million-in-19-green-infrastructure-projects
102,Atikameksheng Anishnawbek Septic & Watermain Upgrade,Planning,2021-01-01,,0,46.398007,-81.17725,Communities,Infrastructure,Atikameksheng Anishnawbek First Nation,The project is for the improvement of septic systems and water distribution in the Atikameksheng Anishnawbek First Nation. The work will replace approximately 300 meters of watermain (including necessary connections and service line to residences and commissioning); and approximately 35 septic systems. The work also includes the addition of a fire hydrant and re-pavement of half the roadway along Maani Street impacted by watermain work.,,,Northeast,25 Reserve Road,P0M2M0,Yes,Yes,Yes,,
106,Repairs and Upgrades at Water Treatment Plant,Under construction,2024-01-01,,130500,52.925885,-82.428892,Communities,Infrastructure,Attawapiskat First Nation,Repair and upgrade various equipment at the water treatment plant.,More secure and safer drinking water.,Kenora,Northwest,,,,Yes,Yes,Yes,
107,Repairs and Upgrades to Sewage Lagoon,Under construction,2024-01-01,,22575,52.925885,-82.428892,Communities,Infrastructure,Attawapiskat First Nation,"Cut brush and vegetation, repair erosion on berm bank, repair fence and install gate.",Improved environmental protection.,Kenora,Northwest,,,,Yes,Yes,Yes,
128,Community Hub in Downtown Barrie,Planning,,,0,,,Communities,Infrastructure,Barrie,"The project will construct a 77,000 square foot facility which will include a youth centre with kitchen, computer lab and recording studio, rehabilitation space for post-cardiac/cancer care; youth outreach/employment offices, meeting rooms, various recreation spaces including aquatic and fitness centres, weight room, track, gymnasium, and indoor playground, and parking spaces",,Simcoe,Central,7315 Yonge Street #1,L9S4V7,Yes,Yes,,Yes,https://www.news.ontario.ca/en/release/1000415/ontario-investing-over-29-million-in-new-community-hub-in-downtown-barrie
137,Rehabilitation of Cannifton Stormwater Pumping Station,Under construction,2023-01-01,,0,44.177731,-77.378813,Communities,Infrastructure,Belleville,"The Project is for the rehabilitation of Cannifton stormwater pumping station in Belleville. The work includes the installation of two submersible pumps, wet well hatches and rails, a flow meter, a control panel and a new roof. The existing fuel tank will be removed to create space for the installation of a new and fixed stand-by diesel generator, and upgrades to the HVAC system and lighting will be completed along with mechanical and structural modifications.","Improve the station's service reliability, and ability to remove stormwater to prevent flooding.",Hastings,East,City Hall  169 Front Street/Rue,K8N2Y8,Yes,Yes,Yes,,
147,Construction of the Bracebridge Multi-Use Community Centre,Planning,2024-01-01,,0,45.0402,-79.3274,Communities,Infrastructure,Bracebridge,"The community centre will include a modern public library, a community hall, accessible indoor multi-sport field house, a lobby, on-site parking and outdoor play spaces",,Muskoka,Central,1000 Taylor Court,P1L1R6,Yes,Yes,,,https://www.news.ontario.ca/en/release/1000421/ontario-investing-over-16-million-in-a-multi-use-community-centre-in-bracebridge
161,Expansion of Chris Gibson Community and Recreation Centre,Planning,2025-08-01,,0,43.681411,-79.776165,Communities,Infrastructure,Brampton,"The project will construct a new 2-storey addition that will accommodate  an NHL-sized ice rink, a double gymnasium, three dance studios and a new main entrance. The project will also include expanded parking lots and driveways",,Peel,Central,2 Wellington St W,L6Y4R2,Yes,Yes,,,https://www.news.ontario.ca/en/release/1000506/ontario-investing-over-18-million-to-expand-chris-gibson-recreation-centre-in-brampton
176,Reconstruction of the city's main sewage pumping station.,Planning,2025-01-01,,300000,44.591667,-75.678333,Communities,Infrastructure,Brockville,Replace an existing sanitary sewer pumping station with a new one.,The pumping station conveys over 90% of the city's wastewater flow to the city's water pollution control center for processing.,Leeds and Grenville,East,,,Yes,Yes,Yes,,
190,Brunswick House Water Treatment System Upgrade,Planning,2024-01-01,,0,47.83488,-83.32558,Communities,Infrastructure,Brunswick House First Nation,"The project will upgrade components of a water treatment facility and complete upgrades to the reservoir in the Brunswick House First Nation in order to reduce the formation of Disinfection Byproducts and provide additional water quality security for water storage. The work will involve a building addition to house a new ozone pre-treatment system and installation of an exterior, below grade contact pipe. Upgrades within the existing facility include ultraviolet equipment, sand filter underdrains replacement and updates to the existing chlorination system. In addition, an epoxy coating will be applied to the interior of the reservoir and a dedicated back up generator for the fire pump will be provided.",,,Northeast,P.O. Box 1178,P0M1K0,Yes,Yes,Yes,,
206,Cambridge Public Library o/a Idea Exchange Hespeler Library Elevator Accessibility and Mechanical Refurbishment,Planning,2025-08-01,,0,43.430867,-80.309673,Communities,Infrastructure,Cambridge,"The Hespeler Library elevator is almost 28 years old and essentially, in its original condition from 1992.  The main objectives of the refurbishment project are:Compliance with accessibility regulationsImproving reliability of elevator operationImproving passenger safetyReduction in energy usageThe Hespeler Library elevator will have new accessibility features  such as Braille plates (interior and exterior), voice annunciation, automatic self leveling, visual and audible direction indicators and updated emergency call system.  The mechanics will be upgraded to microprocessor-based control system to perform all the functions of safe elevator motion and elevator door control.   A new car operating panel will be installed with modern, LED illuminated buttons.Over 130,000 people visited the Hespeler library in 2018. Renovated in 2007, this cultural hub has received several architectural design awards including the 2008 Design Excellence Award/Ontario Association of Architects. In 2015, the building was listed as one of the 10 most beautiful libraries in Canada by Canadian Geographic.  Having maintained a portion of the original 1923 Carnegie library, the Hespeler library is of historical and architectural significance and is a popular destination.",,Waterloo,Southwest,1 North Square,N1S2K6,Yes,Yes,Yes,Yes,https://www.news.ontario.ca/en/release/1000049/residents-of-cambridge-to-benefit-from-improvements-to-community-infrastructure
229,King St. Combined Sewer Separation,Planning,2023-01-01,,0,45.62,-74.6922,Communities,Infrastructure,Champlain,"The Project is for the separation of the combined sewer system along King Street in L'Orignal. The work includes replacement or new construction of approximately 950 metres of storm sewer as well as installation of storm sewer laterals to existing residents, replacement of approximately 450 metres of watermain, relining approximately 450 metres of sanitary sewer and installing associated fixtures such as hydrants, valves, manholes, and catch basins. This is a joint project with the United Counties of Prescott and Russell.",Improved wastewater and storm water management systems and better protection of local waterways for the residents of Champlain Township.,Prescott and Russell,East,948 Pleasant Corner Road East/Est,K0B1R0,Yes,Yes,Yes,,
282,Eiram Stormwater Management Pond Retrofit and Rehabilitation,Planning,2024-01-01,,0,43.93146,-78.677914,Communities,Infrastructure,Clarington,"The Project is for the rehabilitation of the Eiram stormwater pond in Clarington. The work includes the construction of a forebay to the pond, restore the storm sewer inlet and outlet control structure, replace the stone jacket around the extended detention control device, remove accumulated sediment, and improve road access to the pond.","The upgrades will restore the functionality of the pond, improve stormwater management and treatment, and reduce the potential for structural failure that could lead to downstream flooding.",Durham,Central,40 Temperance Street/Rue,L1C3A6,Yes,Yes,Yes,,https://www.news.ontario.ca/en/release/1000034/canada-and-ontario-invest-over-44-m-in-improved-culture-recreation-and-green-infrastructure-in-partnership-with-15-communities-across-ontario
295,5th Avenue - Sanitary and Storm System Re-construction,Planning,2024-01-01,,0,49.03,-81.01,Communities,Infrastructure,Cochrane,"This project is for the rehabilitation of aging stormwater and sanitation infrastructure in the Town of Cochrane. The work will include rehabilitating and replacing approximately 840 metres of sanitary sewer; constructing approximately 240 metres of storm sewers; 7 manholes and 7 catch basins, watermain; and improving approximately 330 metres of road with new subgrade and asphalt, drainage curbs, gutters and sidewalks.  The project is comprised of the replacement/upgrade of the sanitary conveyance system from 5th Avenue traveling east into the laneway of 5th/6th Avenue, south to 5th Street and north to 6th Street, the rehabilitation of the sanitary main running eastward from First Avenue to Fifth Avenue, as well as the replacement/upgrade of the storm water drainage system running from 5th Avenue along 6th Street, coupled with a new storm sewer outflow into Lilly Lake north of 6th Street.  This project also includes re-construction of a portion of 5th Avenue and partial re-construction /rehabilitation of 6th Street.",,Cochrane,Northeast,171 Fourth Avenue,P0L1C0,Yes,Yes,Yes,,https://www.news.ontario.ca/en/release/1000459/canada-and-ontario-invest-over-29-million-in-19-green-infrastructure-projects
307,Couchiching First Nation Stormwater Management Infrastructure Upgrades,Planning,2023-01-01,,0,48.634167,-93.359722,Communities,Infrastructure,Couchiching First Nation,"This Project will improve stormwater management in the Couchiching First Nation. The work includes topographical and geotechnical surveys, regrading approximately 10 kilometers of road for water diversion, clearing and expanding ditches, clearing or upsizing approximately 150 culverts, and treating and improving the quality of stormwater effluent by introducing wetland plants and swales.",,,Northwest,107 Highway 11,P9A3M3,Yes,Yes,Yes,,
311,Curve Lake Catch Basin and Roads Stormwater Improvements,Under construction,2023-01-01,,0,44.508029,-78.363111,Communities,Infrastructure,Curve Lake First Nation,"The Project is for the improvement of stormwater drainage on Mississauga Road in Curve Lake. It involves rehabilitating drainage ditches along approximately 14.2 kilometres of road, replacing two stormwater catch basins, and upgrading a portion of the road surface.",Reduce the risk of storm water flooding by redirecting water run-off away from roads and people's homes.,,East,General Delivery,K0L1R0,Yes,Yes,Yes,,
321,Lagoon Expansion,Planning,2025-11-01,,0,46.120627,-80.058629,Communities,Infrastructure,Dokis First Nation,"The Project will rehabilitate and expand the wastewater lagoon in the Dokis First Nation. The work includes designing and constructing modifications to the existing lagoon cell and construction of a new lagoon cell for expanded capacity. The modifications will involve implementation of a pre-treatment system, installation of electricity on-site to power the pre-treatment system, the addition of separation membranes to channel wastewater flow and expansion of the lagoon’s capacity.","Enable the lagoon to meet current federal and provincial discharge requirements, reduce the accumulation of wastewater sediment and help meet current and future wastewater treatment demands.",,Northeast,940 MAIN Street,P0M2N1,Yes,Yes,Yes,,
373,Emo Water Treatment Plant Upgrades & Optimization for THM & HAA Reduction,Planning,2023-01-01,,0,48.628384,-93.844125,Communities,Infrastructure,Emo,"The Project will upgrade a water treatment plant in Emo.The work will involve flushing, cleaning  and removing sand deposits from the bottom of raw water pipes, installing an intake screen, upgrading the chemical feed system, and installing an automatic switchover panel and Anion Exchange treatment solution including two pressure rated vessels, a brine tank, backwash kit, microprocessor controller and an anion exchange media.","Improve the facility's performance, lengthen its lifespan, and ensure area residents have increased access to quality drinking water and a healthier living environment.",Rainy River,Northwest,39 Roy St,P0W1E0,Yes,Yes,Yes,,
376,Englehart Water Supply Upgrade,Planning,2025-12-01,,0,47.823838,-79.866934,Communities,Infrastructure,Englehart,"This Project will expand the drinking water supply and storage capacity in Englehart. The work will include: the construction of one additional drilled well with pump; upgrades to two existing wells; installing a new standpipe to increase water storage capacity; add variable frequency drives to well pumps to provide additional flow control capabilities; upgrade mechanical, electrical and SCADA systems to accommodate new equipment and controls; a hydrogeological investigation (aquifer study), geotechnical investigation, mechanical and piping modifications, and electrical and control modifications.",,Timiskaming,Northeast,61 Fifth Ave,P0J1H0,Yes,Yes,Yes,,https://www.news.ontario.ca/en/release/1000459/canada-and-ontario-invest-over-29-million-in-19-green-infrastructure-projects
417,Replacement of Drinking Water Pipes in the Block subdivision in the Village at Garden River First Nation,Planning,2023-01-01,,0,46.551,-84.149,Communities,Infrastructure,Garden River First Nation,"This project is for the replacement of a watermain and the installation of 12 new fire hydrants in the Block subdivision on Green Sky Street, Wigwaus Street, Gemah Street, and Highway 17B in Garden River First Nation. The work includes replacing approximately five kilometres of two-inch pipe with six-inch pipe, installing isolation valves at all ""tee"" and ""cross"" pipe intersections as well as approximately 300 metre intervals on straight runs; and installing 12 new fire hydrants.",,Algoma,Northeast,7 Shingwauk Street,P6A6Z8,Yes,Yes,Yes,,
434,Replacement of Failing Sewage Pumping Stations,Planning,2023-01-01,,0,50.149086,-94.003087,Communities,Infrastructure,Grassy Narrows First Nations,"The project will replace failing sewage pumps in the Grassy Narrows First Nation. The work will involve the decommissioning and replacement five (5) failing sewage pumping stations with new equipment and installing new process piping, fittings, valves and associated components for each station.",,,Northwest,General Delivery,P0X1B0,Yes,Yes,Yes,,
